{
  "schema_version": 1,
  "catalog_id": "architecture-playbook-resource-catalog",
  "updated_at": "2026-08-25T00:00:00.000Z",
  "sources": [
    {
      "source_id": "mcblock",
      "title": "MCBlock 建筑库",
      "lifecycle_status": "assessed",
      "profile_path": "sources/mcblock/source.json",
      "assessment_path": "sources/mcblock/assessment.md"
    },
    {
      "source_id": "zh-minecraft-wiki",
      "title": "中文 Minecraft Wiki 建筑教程",
      "lifecycle_status": "assessed",
      "profile_path": "sources/zh-minecraft-wiki/source.json",
      "assessment_path": "sources/zh-minecraft-wiki/assessment.md"
    }
  ]
}
